--------------
/* Jared Stevens */

    /* enable warnings! */

use a_testbed
--------------

Query OK, 0 rows affected (0.00 sec)

--------------
/*  TASK 00 */ 

select user(), current_date(), version(), @@sql_mode
--------------

*************************** 1. row ***************************
        user(): jared@localhost
current_date(): 2015-08-19
     version(): 5.6.26-log
    @@sql_mode: STRICT_TRANS_TABLES,NO_AUTO_CREATE_USER,NO_ENGINE_SUBSTITUTION
1 row in set (0.01 sec)

--------------
/*  TASK 01 */

delete 
from a_testbed.zoo_2015
where z_id > 100
--------------

Query OK, 3 rows affected (0.03 sec)

--------------
select * 
from zoo_2015
--------------

+------+----------------+-----------+---------+---------------------+------------+
| z_id | z_name         | z_type    | z_cost  | z_dob               | z_acquired |
+------+----------------+-----------+---------+---------------------+------------+
|   23 | Sam            | Giraffe   | 5000.00 | 2014-05-15 00:00:00 | 2014-05-15 |
|   25 | Abigail        | Armadillo |  490.00 | 2013-01-15 00:00:00 | 2013-04-05 |
|   56 | Leon           | Lion      | 5000.00 | 2010-02-25 00:00:00 | 2010-03-25 |
|   57 | Lenora         | Lion      | 5000.00 | 2014-03-25 00:00:00 | 2014-03-31 |
|   85 | Sally Robinson | Giraffe   | 5000.25 | 2014-05-15 00:00:00 | 2014-05-15 |
|   43 | Huey           | Zebra     | 2500.25 | 2013-06-02 00:00:00 | 2014-06-02 |
|   44 | Dewey          | Zebra     | 2500.25 | 2014-06-02 00:00:00 | 2014-06-02 |
|   45 | Louie          | Zebra     | 2500.25 | 2013-01-02 00:00:00 | 2014-01-02 |
|   47 | NULL           | Horse     |  490.00 | 2015-01-10 00:00:00 | 2015-01-15 |
|   52 | Dewey          | Giraffe   | 3750.00 | 2013-06-06 00:00:00 | 2013-07-12 |
+------+----------------+-----------+---------+---------------------+------------+
10 rows in set (0.00 sec)

--------------
/*  TASK 02 */

insert into zoo_2015 values
(
	101
	, 'John'
	, 'Zebra'
	, 3500.00
	, '2014-01-21 09:30:00'
	, '2014-03-05'
),
(
	102
	, 'Jacob'
	, 'Rhino'
	, 6750.00
	, '2012-03-12 23:59:00'
	, ' 2013-05-17'
),
(
	103
	, 'JingleHeimer'
	, 'Camel'
	, 1200.00
	, '2003-01-19 12:45:00'
	, '2003-02-10'
)
--------------

Query OK, 3 rows affected (0.01 sec)
Records: 3  Duplicates: 0  Warnings: 0

--------------
/*  TASK 03 */

insert into a_testbed.zoo_2015 values

(
104,
'Abe',
'Armadillo',
490.00,
'2015-8-18 22:21:00',
'2015-8-18'
),
(
105,
'Brandon',
'Giraffe',
4900.00,
'2015-8-18 22:22:00',
'2015-8-18'
),
(
106,
'Chuck',
'Horse',
490.00,
'2015-8-18 22:23:00',
'2015-8-18'
)
--------------

Query OK, 3 rows affected (0.00 sec)
Records: 3  Duplicates: 0  Warnings: 0

--------------
Insert Into zoo_2015 values
(101
, 'George'
, 'Giraffe'
, 1000.00
, '2000-01-02 00:00:00'
, '2000-03-04'
),
(102
, 'Geoffrey'
, 'Giraffe'
, 1000.00
, '2000-05-06 00:00:01'
, '2000-07-08'
),
(103
, 'Geordon'
, 'Giraffe'
, 1000.00
, '2000-09-10 00:00:02'
, '2000-11-12'
)
--------------

Query OK, 3 rows affected (0.00 sec)
Records: 3  Duplicates: 0  Warnings: 0

--------------
/*  TASK 04 */

select 
	z_id
	, z_name
	, z_type
	, z_cost
	, z_dob
	, z_acquired
	from zoo_2015
--------------

+------+----------------+-----------+---------+---------------------+------------+
| z_id | z_name         | z_type    | z_cost  | z_dob               | z_acquired |
+------+----------------+-----------+---------+---------------------+------------+
|   23 | Sam            | Giraffe   | 5000.00 | 2014-05-15 00:00:00 | 2014-05-15 |
|   25 | Abigail        | Armadillo |  490.00 | 2013-01-15 00:00:00 | 2013-04-05 |
|   56 | Leon           | Lion      | 5000.00 | 2010-02-25 00:00:00 | 2010-03-25 |
|   57 | Lenora         | Lion      | 5000.00 | 2014-03-25 00:00:00 | 2014-03-31 |
|   85 | Sally Robinson | Giraffe   | 5000.25 | 2014-05-15 00:00:00 | 2014-05-15 |
|   43 | Huey           | Zebra     | 2500.25 | 2013-06-02 00:00:00 | 2014-06-02 |
|   44 | Dewey          | Zebra     | 2500.25 | 2014-06-02 00:00:00 | 2014-06-02 |
|   45 | Louie          | Zebra     | 2500.25 | 2013-01-02 00:00:00 | 2014-01-02 |
|   47 | NULL           | Horse     |  490.00 | 2015-01-10 00:00:00 | 2015-01-15 |
|   52 | Dewey          | Giraffe   | 3750.00 | 2013-06-06 00:00:00 | 2013-07-12 |
|  101 | John           | Zebra     | 3500.00 | 2014-01-21 09:30:00 | 2014-03-05 |
|  102 | Jacob          | Rhino     | 6750.00 | 2012-03-12 23:59:00 | 2013-05-17 |
|  103 | JingleHeimer   | Camel     | 1200.00 | 2003-01-19 12:45:00 | 2003-02-10 |
|  104 | Abe            | Armadillo |  490.00 | 2015-08-18 22:21:00 | 2015-08-18 |
|  105 | Brandon        | Giraffe   | 4900.00 | 2015-08-18 22:22:00 | 2015-08-18 |
|  106 | Chuck          | Horse     |  490.00 | 2015-08-18 22:23:00 | 2015-08-18 |
|  101 | George         | Giraffe   | 1000.00 | 2000-01-02 00:00:00 | 2000-03-04 |
|  102 | Geoffrey       | Giraffe   | 1000.00 | 2000-05-06 00:00:01 | 2000-07-08 |
|  103 | Geordon        | Giraffe   | 1000.00 | 2000-09-10 00:00:02 | 2000-11-12 |
+------+----------------+-----------+---------+---------------------+------------+
19 rows in set (0.00 sec)

--------------
/*  TASK 05 */

select 
	z_type
	, z_name
	, z_cost
	from zoo_2015
	order by z_type, z_name
--------------

+-----------+----------------+---------+
| z_type    | z_name         | z_cost  |
+-----------+----------------+---------+
| Armadillo | Abe            |  490.00 |
| Armadillo | Abigail        |  490.00 |
| Camel     | JingleHeimer   | 1200.00 |
| Giraffe   | Brandon        | 4900.00 |
| Giraffe   | Dewey          | 3750.00 |
| Giraffe   | Geoffrey       | 1000.00 |
| Giraffe   | Geordon        | 1000.00 |
| Giraffe   | George         | 1000.00 |
| Giraffe   | Sally Robinson | 5000.25 |
| Giraffe   | Sam            | 5000.00 |
| Horse     | NULL           |  490.00 |
| Horse     | Chuck          |  490.00 |
| Lion      | Lenora         | 5000.00 |
| Lion      | Leon           | 5000.00 |
| Rhino     | Jacob          | 6750.00 |
| Zebra     | Dewey          | 2500.25 |
| Zebra     | Huey           | 2500.25 |
| Zebra     | John           | 3500.00 |
| Zebra     | Louie          | 2500.25 |
+-----------+----------------+---------+
19 rows in set (0.00 sec)

--------------
/*  TASK 06 */

select	
	z_id
	, z_name as "Name"
	, z_dob as "Birthdate"
	from zoo_2015
	order by z_dob
--------------

+------+----------------+---------------------+
| z_id | Name           | Birthdate           |
+------+----------------+---------------------+
|  101 | George         | 2000-01-02 00:00:00 |
|  102 | Geoffrey       | 2000-05-06 00:00:01 |
|  103 | Geordon        | 2000-09-10 00:00:02 |
|  103 | JingleHeimer   | 2003-01-19 12:45:00 |
|   56 | Leon           | 2010-02-25 00:00:00 |
|  102 | Jacob          | 2012-03-12 23:59:00 |
|   45 | Louie          | 2013-01-02 00:00:00 |
|   25 | Abigail        | 2013-01-15 00:00:00 |
|   43 | Huey           | 2013-06-02 00:00:00 |
|   52 | Dewey          | 2013-06-06 00:00:00 |
|  101 | John           | 2014-01-21 09:30:00 |
|   57 | Lenora         | 2014-03-25 00:00:00 |
|   85 | Sally Robinson | 2014-05-15 00:00:00 |
|   23 | Sam            | 2014-05-15 00:00:00 |
|   44 | Dewey          | 2014-06-02 00:00:00 |
|   47 | NULL           | 2015-01-10 00:00:00 |
|  104 | Abe            | 2015-08-18 22:21:00 |
|  105 | Brandon        | 2015-08-18 22:22:00 |
|  106 | Chuck          | 2015-08-18 22:23:00 |
+------+----------------+---------------------+
19 rows in set (0.00 sec)

--------------
/*  TASK 07 */

show tables
--------------

+---------------------+
| Tables_in_a_testbed |
+---------------------+
| zoo_2015            |
+---------------------+
1 row in set (0.00 sec)

--------------
/*  TASK 08 */

desc a_testbed.zoo_2015
--------------

+------------+-----------------------+------+-----+---------+-------+
| Field      | Type                  | Null | Key | Default | Extra |
+------------+-----------------------+------+-----+---------+-------+
| z_id       | int(11)               | NO   |     | NULL    |       |
| z_name     | varchar(25)           | YES  |     | NULL    |       |
| z_type     | varchar(25)           | NO   |     | NULL    |       |
| z_cost     | decimal(7,2) unsigned | NO   |     | NULL    |       |
| z_dob      | datetime              | NO   |     | NULL    |       |
| z_acquired | date                  | NO   |     | NULL    |       |
+------------+-----------------------+------+-----+---------+-------+
6 rows in set (0.02 sec)

--------------
/*  TASK 09 */

show variables like 'char%'
--------------

+--------------------------+---------------------------------------------------------+
| Variable_name            | Value                                                   |
+--------------------------+---------------------------------------------------------+
| character_set_client     | cp850                                                   |
| character_set_connection | cp850                                                   |
| character_set_database   | utf8                                                    |
| character_set_filesystem | binary                                                  |
| character_set_results    | cp850                                                   |
| character_set_server     | utf8                                                    |
| character_set_system     | utf8                                                    |
| character_sets_dir       | C:\Program Files\MySQL\MySQL Server 5.6\share\charsets\ |
+--------------------------+---------------------------------------------------------+
8 rows in set (0.00 sec)

Bye
